{
  "$schema": "https://json-schema.org/draft/2020-12/schema",
  "title": "TechLead OS11 Exam Schema",
  "type": "object",
  "required": [
    "id",
    "title",
    "description",
    "questionCount",
    "questions"
  ],
  "properties": {
    "id": {
      "type": "string"
    },
    "title": {
      "type": "string"
    },
    "description": {
      "type": "string"
    },
    "questionCount": {
      "type": "integer",
      "minimum": 0
    },
    "categories": {
      "type": "array",
      "items": {
        "type": "string"
      }
    },
    "sourceFile": {
      "type": "string"
    },
    "course": {
      "type": "object",
      "required": [
        "id",
        "title"
      ],
      "properties": {
        "id": {
          "type": "string"
        },
        "title": {
          "type": "string"
        }
      }
    },
    "questions": {
      "type": "array",
      "items": {
        "type": "object",
        "required": [
          "id",
          "question",
          "options",
          "correctAnswer"
        ],
        "properties": {
          "id": {
            "type": "string"
          },
          "question": {
            "type": "string"
          },
          "options": {
            "type": "array",
            "items": {
              "type": "object",
              "required": [
                "id",
                "text"
              ],
              "properties": {
                "id": {
                  "type": "string"
                },
                "text": {
                  "type": "string"
                }
              }
            }
          },
          "correctAnswer": {
            "type": "string"
          },
          "explanation": {
            "type": [
              "string",
              "null"
            ]
          },
          "category": {
            "type": [
              "string",
              "null"
            ]
          },
          "source": {
            "type": "object"
          }
        }
      }
    }
  }
}
