{
  "id": "web-developers-special-list",
  "title": "Special List",
  "description": "90 questions extracted from data/Web developers/Web- developer-specialList.json.",
  "questionCount": 90,
  "categories": [
    "Web developers"
  ],
  "course": {
    "id": "web-developers",
    "title": "Web developers"
  },
  "sourceFile": "data/Web developers/Web- developer-specialList.json",
  "questions": [
    {
      "id": "web-developers-special-list-q001",
      "question": "What is a recommended naming convention for foreign keys in OutSystems?",
      "options": [
        {
          "id": "a",
          "text": "Use camelCase |"
        },
        {
          "id": "b",
          "text": "Suffix with 'Key' |"
        },
        {
          "id": "c",
          "text": "Suffix with 'Id' |"
        },
        {
          "id": "d",
          "text": "Use lowercase"
        }
      ],
      "correctAnswer": "c",
      "explanation": "Suffix with 'Id'",
      "image": null,
      "category": "Web developers",
      "source": {
        "questionNumber": 1,
        "sourceType": "json",
        "answerImages": 0,
        "questionImages": 0
      }
    },
    {
      "id": "web-developers-special-list-q002",
      "question": "Which practice is advised for screen preparation to enhance performance?",
      "options": [
        {
          "id": "a",
          "text": "Minimize database queries |"
        },
        {
          "id": "b",
          "text": "Use complex queries |"
        },
        {
          "id": "c",
          "text": "Always use AJAX |"
        },
        {
          "id": "d",
          "text": "Increase server variables"
        }
      ],
      "correctAnswer": "a",
      "explanation": "Minimize database queries",
      "image": null,
      "category": "Web developers",
      "source": {
        "questionNumber": 2,
        "sourceType": "json",
        "answerImages": 0,
        "questionImages": 0
      }
    },
    {
      "id": "web-developers-special-list-q003",
      "question": "How should large text attributes be managed in OutSystems?",
      "options": [
        {
          "id": "a",
          "text": "Keep in main entity |"
        },
        {
          "id": "b",
          "text": "Use a separate entity |"
        },
        {
          "id": "c",
          "text": "Store as binary |"
        },
        {
          "id": "d",
          "text": "Use text fields"
        }
      ],
      "correctAnswer": "b",
      "explanation": "Use a separate entity",
      "image": null,
      "category": "Web developers",
      "source": {
        "questionNumber": 3,
        "sourceType": "json",
        "answerImages": 0,
        "questionImages": 0
      }
    },
    {
      "id": "web-developers-special-list-q004",
      "question": "What is the best practice for handling sensitive data in URLs?",
      "options": [
        {
          "id": "a",
          "text": "Encrypt the URL |"
        },
        {
          "id": "b",
          "text": "Use plain text |"
        },
        {
          "id": "c",
          "text": "Exclude sensitive data |"
        },
        {
          "id": "d",
          "text": "Use HTTPS"
        }
      ],
      "correctAnswer": "c",
      "explanation": "Exclude sensitive data",
      "image": null,
      "category": "Web developers",
      "source": {
        "questionNumber": 4,
        "sourceType": "json",
        "answerImages": 0,
        "questionImages": 0
      }
    },
    {
      "id": "web-developers-special-list-q005",
      "question": "Which method is preferred for bulk operations on records?",
      "options": [
        {
          "id": "a",
          "text": "Use Aggregates |"
        },
        {
          "id": "b",
          "text": "Use SQL statements |"
        },
        {
          "id": "c",
          "text": "Use JavaScript |"
        },
        {
          "id": "d",
          "text": "Use individual inserts"
        }
      ],
      "correctAnswer": "b",
      "explanation": "Use SQL statements",
      "image": null,
      "category": "Web developers",
      "source": {
        "questionNumber": 5,
        "sourceType": "json",
        "answerImages": 0,
        "questionImages": 0
      }
    },
    {
      "id": "web-developers-special-list-q006",
      "question": "What is the purpose of using Static Entities?",
      "options": [
        {
          "id": "a",
          "text": "To store dynamic data |"
        },
        {
          "id": "b",
          "text": "Replace hard-coded values |"
        },
        {
          "id": "c",
          "text": "Manage user roles |"
        },
        {
          "id": "d",
          "text": "Define CSS styles"
        }
      ],
      "correctAnswer": "b",
      "explanation": "Replace hard-coded values",
      "image": null,
      "category": "Web developers",
      "source": {
        "questionNumber": 6,
        "sourceType": "json",
        "answerImages": 0,
        "questionImages": 0
      }
    },
    {
      "id": "web-developers-special-list-q007",
      "question": "How should you approach adding comments in JavaScript?",
      "options": [
        {
          "id": "a",
          "text": "Avoid comments |"
        },
        {
          "id": "b",
          "text": "Comment only complex logic |"
        },
        {
          "id": "c",
          "text": "Comment generously |"
        },
        {
          "id": "d",
          "text": "Use comments sparingly"
        }
      ],
      "correctAnswer": "b",
      "explanation": "Comment only complex logic",
      "image": null,
      "category": "Web developers",
      "source": {
        "questionNumber": 7,
        "sourceType": "json",
        "answerImages": 0,
        "questionImages": 0
      }
    },
    {
      "id": "web-developers-special-list-q008",
      "question": "What is the recommended approach to database maintenance?",
      "options": [
        {
          "id": "a",
          "text": "Ignore maintenance |"
        },
        {
          "id": "b",
          "text": "Setup regular plans |"
        },
        {
          "id": "c",
          "text": "Backup occasionally |"
        },
        {
          "id": "d",
          "text": "Optimize when needed"
        }
      ],
      "correctAnswer": "b",
      "explanation": "Setup regular plans",
      "image": null,
      "category": "Web developers",
      "source": {
        "questionNumber": 8,
        "sourceType": "json",
        "answerImages": 0,
        "questionImages": 0
      }
    },
    {
      "id": "web-developers-special-list-q009",
      "question": "How should you handle a module size larger than 4 MB?",
      "options": [
        {
          "id": "a",
          "text": "Ignore it |"
        },
        {
          "id": "b",
          "text": "Split the module |"
        },
        {
          "id": "c",
          "text": "Increase server capacity |"
        },
        {
          "id": "d",
          "text": "Consider it a sign of poor architecture"
        }
      ],
      "correctAnswer": "d",
      "explanation": "Consider it a sign of poor architecture",
      "image": null,
      "category": "Web developers",
      "source": {
        "questionNumber": 9,
        "sourceType": "json",
        "answerImages": 0,
        "questionImages": 0
      }
    },
    {
      "id": "web-developers-special-list-q010",
      "question": "Why should you avoid creating custom HTML/JavaScript in OutSystems?",
      "options": [
        {
          "id": "a",
          "text": "Enhances performance |"
        },
        {
          "id": "b",
          "text": "Increases maintainability |"
        },
        {
          "id": "c",
          "text": "Reduces complexity |"
        },
        {
          "id": "d",
          "text": "Makes it harder to change"
        }
      ],
      "correctAnswer": "d",
      "explanation": "Makes it harder to change",
      "image": null,
      "category": "Web developers",
      "source": {
        "questionNumber": 10,
        "sourceType": "json",
        "answerImages": 0,
        "questionImages": 0
      }
    },
    {
      "id": "web-developers-special-list-q011",
      "question": "What is a benefit of data archiving?",
      "options": [
        {
          "id": "a",
          "text": "Increases database size |"
        },
        {
          "id": "b",
          "text": "Improves runtime performance |"
        },
        {
          "id": "c",
          "text": "Reduces query performance |"
        },
        {
          "id": "d",
          "text": "Slows down backups"
        }
      ],
      "correctAnswer": "b",
      "explanation": "Improves runtime performance",
      "image": null,
      "category": "Web developers",
      "source": {
        "questionNumber": 11,
        "sourceType": "json",
        "answerImages": 0,
        "questionImages": 0
      }
    },
    {
      "id": "web-developers-special-list-q012",
      "question": "How should you handle indexes for archived data?",
      "options": [
        {
          "id": "a",
          "text": "Disable indexes |"
        },
        {
          "id": "b",
          "text": "Ignore indexes |"
        },
        {
          "id": "c",
          "text": "Optimize indexes |"
        },
        {
          "id": "d",
          "text": "Use default settings"
        }
      ],
      "correctAnswer": "c",
      "explanation": "Optimize indexes",
      "image": null,
      "category": "Web developers",
      "source": {
        "questionNumber": 12,
        "sourceType": "json",
        "answerImages": 0,
        "questionImages": 0
      }
    },
    {
      "id": "web-developers-special-list-q013",
      "question": "Which layer in the architecture is responsible for business processes?",
      "options": [
        {
          "id": "a",
          "text": "Connectors |"
        },
        {
          "id": "b",
          "text": "Core Entities |"